Star-rating,Name,Reviewer Profile Url,Review Title,Review Content,images,profile icon,Date,helpful,verified,variant,rating,text_ko
5.0 out of 5 stars,Janelle Wilkinson,https://www.amazon.com/gp/customer-reviews/R1YERWZ6XJQP29/ref=cm_cr_getr_d_rvw_ttl?ie=UTF8&ASIN=B0BN2PX8V3,"5.0 out of 5 stars
 GOOD BUY !",LOVE THIS WORK WONDERS . JUST BE CONSTISTENT .,,https://images-na.ssl-images-amazon.com/images/G/01/x-locale/common/grey-pixel.gif,"Reviewed in the United States on April 19, 2025",0,Verified Purchase,,5,이 작품이 정말 마음에 듭니다. 일관성을 유지하세요.
5.0 out of 5 stars,Clarissa Reyes,https://www.amazon.com/gp/customer-reviews/RYHKTUIIWSUO1/ref=cm_cr_getr_d_rvw_ttl?ie=UTF8&ASIN=B0BN2PX8V3,"5.0 out of 5 stars
 Face change",BEST FOR OILY FACE been struggling for years always have an oily face I shine from 1000 Miles’s away but this life change the best same day results no lie worth every penny ❗️❗️❗️,,https://images-na.ssl-images-amazon.com/images/G/01/x-locale/common/grey-pixel.gif,"Reviewed in the United States on March 29, 2025",One person found this helpful,Verified Purchase,,5,BEST FOR OILY FACE 수년 동안 어려움을 겪었습니다. 항상 기름진 얼굴을 가지고 있습니다. 나는 1000마일 떨어진 곳에서 빛나지만 이 인생은 당일 최고의 결과를 가져옵니다. 한 푼도 아깝지 않습니다 ❗️❗️❗️
5.0 out of 5 stars,Amanda McCarthy,https://www.amazon.com/gp/customer-reviews/ROYBIWOY6E50A/ref=cm_cr_getr_d_rvw_ttl?ie=UTF8&ASIN=B0BN2PX8V3,"5.0 out of 5 stars
 It actually works!",This stuff smells amazing! It’s odd at first putting oil on dry skin but after washing it off with water and then cleaning my face with the foam face wash my skin feels so soft and there are so many less black heads!! I was skeptical since it was just something I casually came across on FB but it actually works!!,,https://images-na.ssl-images-amazon.com/images/G/01/x-locale/common/grey-pixel.gif,"Reviewed in the United States on March 11, 2025",One person found this helpful,Verified Purchase,,5,이 물건 냄새가 정말 대단해요! 건조한 피부에 처음 오일을 바르는 건 좀 이상하지만 물로 세안하고 거품 세안을 하고 나니 피부가 부드러워지고 블랙헤드도 많이 줄었어요!! FB에서 우연히 접한 내용이라 회의적이었지만 실제로 작동합니다!!
5.0 out of 5 stars,Jordan guigui,https://www.amazon.com/gp/customer-reviews/R1JRCPDUJIXCID/ref=cm_cr_getr_d_rvw_ttl?ie=UTF8&ASIN=B0BN2PX8V3,"5.0 out of 5 stars
 Love all there products","This brand is absolutely amazing
I have been hooked on it since a few months
In order for this product to be used properly, you need to use it on dry skin and massaged it for about 30 seconds to clean all of the pores and dirt in your face and then rest it off with water
And then you also are recommended to wash your face with something that is not oily and use this only at night.
It has helped my skin brighten so much and has kept it clean for months",,https://images-na.ssl-images-amazon.com/images/G/01/x-locale/common/grey-pixel.gif,"Reviewed in the United States on March 10, 2025",14 people found this helpful,Verified Purchase,,5,"이 브랜드는 정말 놀랍습니다
몇 달 전부터 푹 빠져 있어요.
본 제품을 제대로 사용하기 위해서는 건조한 피부에 사용 후 30초 정도 마사지하여 얼굴의 모공과 노폐물을 모두 닦아낸 후 물로 씻어내면 됩니다.
그리고 기름지지 않은 제품으로 세안하고 밤에만 사용하는 것이 좋습니다.
피부가 너무 밝아지고 몇 달 동안 깨끗하게 유지되는 데 도움이되었습니다."
5.0 out of 5 stars,Marileysis,https://www.amazon.com/gp/customer-reviews/R2O2BG1GDDG5L6/ref=cm_cr_getr_d_rvw_ttl?ie=UTF8&ASIN=B0BN2PX8V3,"5.0 out of 5 stars
 Incredible oil cleanser, leaves the skin soft and clean!","""I loved this cleaner in Anua oil. Dissolves makeup and dirt effortlessly, even waterproof products. The texture is light, does not leave a greasy feeling and rinses easily without irritating the skin. After using it, my face feels hydrated and fresh. In addition, its formula is soft and perfect for sensitive skin. I will definitely buy it again!""","https://m.media-amazon.com/images/I/61eUMTl435L.88.jpg  
","https://images-na.ssl-images-amazon.com/images/S/amazon-avatars-global/default._CR0,0,1024,1024_SX48_.png","Reviewed in the United States on March 17, 2025",5 people found this helpful,Verified Purchase,,5,"""아누아 오일이 함유된 이 클렌저가 마음에 들었습니다. 메이크업과 노폐물을 잘 녹여주고, 워터프루프 제품도 잘 녹여줍니다. 질감이 가볍고 끈적임이 없으며, 피부에 자극 없이 쉽게 헹구어집니다. 사용하고 나면 얼굴이 촉촉하고 산뜻한 느낌이 듭니다. 게다가 포뮬러가 부드러워서 민감한 피부에도 딱 맞습니다. 꼭 재구매할 거예요!"""
5.0 out of 5 stars,Peter,https://www.amazon.com/gp/customer-reviews/R2VIDZ4J6OCSZM/ref=cm_cr_getr_d_rvw_ttl?ie=UTF8&ASIN=B0BN2PX8V3,"5.0 out of 5 stars
 A simple yet wonderful product!","I have fairly oily skin and zero aptitude for complicated skin care routines. To put it into perspective, I washed my face with nothing but Cetaphil for a good couple decades before they changed the formula and it no longer worked for me!

Now I use this cleanser to double cleanse my face before using my facewash and I can't say enough good things about it. I truly feel like my facewash does so much more for my skin when I use this product first. It's an absolute must have for me!",,"https://images-na.ssl-images-amazon.com/images/S/amazon-avatars-global/default._CR0,0,1024,1024_SX48_.png","Reviewed in the United States on March 3, 2025",4 people found this helpful,Verified Purchase,,5,"나는 상당히 지성 피부를 가지고 있으며 복잡한 피부 관리 루틴에 대한 적성이 없습니다. 관점을 바꿔 말하자면, 공식이 바뀌기 전까지 저는 수십 년 동안 세타필로만 세수를 했는데 더 이상 효과가 없었습니다!

이제 나는 세안제를 사용하기 전에 이 클렌저를 사용하여 얼굴을 두 번 정화하는데, 그것에 대해 충분히 좋은 말을 할 수 없습니다. 이 제품을 처음 사용할 때 세안제가 피부에 훨씬 더 많은 영향을 미치는 것 같은 느낌이 들었습니다. 나에게 꼭 필요한 아이템이에요!"
5.0 out of 5 stars,Elienais,https://www.amazon.com/gp/customer-reviews/R8K17UDFKJ6R6/ref=cm_cr_getr_d_rvw_ttl?ie=UTF8&ASIN=B0BN2PX8V3,"5.0 out of 5 stars
 Loved the product",Very good product I loved it leaves my face super clean silky I would definitely buy it again,,"https://images-na.ssl-images-amazon.com/images/S/amazon-avatars-global/default._CR0,0,1024,1024_SX48_.png","Reviewed in the United States on April 5, 2025",0,Verified Purchase,,5,아주 좋은 제품 마음에 들었고 얼굴이 매우 깨끗하고 매끄럽게 유지됩니다. 꼭 다시 구매할 것입니다
5.0 out of 5 stars,Amphib_Warrior,https://www.amazon.com/gp/customer-reviews/R2J3XHLESD0G76/ref=cm_cr_getr_d_rvw_ttl?ie=UTF8&ASIN=B0BN2PX8V3,"5.0 out of 5 stars
 good","i love this cleansing oil, always repurchase",,"https://images-na.ssl-images-amazon.com/images/S/amazon-avatars-global/default._CR0,0,1024,1024_SX48_.png","Reviewed in the United States on April 14, 2025",0,Verified Purchase,,5,클렌징오일 너무 맘에 들어요 항상 재구매해요
5.0 out of 5 stars,Amazon Customer,https://www.amazon.com/gp/customer-reviews/RGJSGGEUB96CC/ref=cm_cr_getr_d_rvw_ttl?ie=UTF8&ASIN=B0BN2PX8V3,"5.0 out of 5 stars
 My favorite oil cleanser","This oil cleanser works great for me and helps me to get through the winter months. I use this pretty much year-round, except for the summer months. Great product.",,https://images-na.ssl-images-amazon.com/images/G/01/x-locale/common/grey-pixel.gif,"Reviewed in the United States on March 26, 2025",0,Verified Purchase,,5,이 오일 클렌저는 나에게 아주 효과적이며 겨울철을 견디는 데 도움이 됩니다. 여름철을 제외하고는 거의 일년 내내 이것을 사용합니다. 훌륭한 제품.
5.0 out of 5 stars,Cameron,https://www.amazon.com/gp/customer-reviews/R134KRAXFDGYZ0/ref=cm_cr_getr_d_rvw_ttl?ie=UTF8&ASIN=B0BN2PX8V3,"5.0 out of 5 stars
 Must buy",I love this cleanser! I am on my 4th bottle and will continue to repurchase!,,https://images-na.ssl-images-amazon.com/images/G/01/x-locale/common/grey-pixel.gif,"Reviewed in the United States on April 7, 2025",0,Verified Purchase,,5,나는이 클렌저를 좋아한다! 4통째인데 계속 재구매할 예정이에요!
5.0 out of 5 stars,Melanie,https://www.amazon.com/gp/customer-reviews/R1GKTDKAMASQ6L/ref=cm_cr_getr_d_rvw_ttl?ie=UTF8&ASIN=B0BN2PX8V3,"5.0 out of 5 stars
 saved my skin","I was struggling so much with my skin lately, it was super dry and peeling but also somehow oily at the same time, and I tried so many things to fix it, but this is the thing that worked! I double cleanse with this and then my foaming cleanser afterwards and my skin is so much more hydrated, not peeling anymore and less oily.",,https://images-na.ssl-images-amazon.com/images/G/01/x-locale/common/grey-pixel.gif,"Reviewed in the United States on March 10, 2025",3 people found this helpful,Verified Purchase,,5,요즘 피부가 너무 힘들어서 엄청 건조하고 각질이 생기기도 하고 뭔가 기름지기도 해서 고치려고 이것저것 시도해봤는데 효과가 있었어요! 저는 이것으로 두 번 클렌징한 다음 포밍 클렌저로 피부를 훨씬 더 촉촉하게 만들고 더 이상 벗겨지지 않고 덜 기름진 느낌을 줍니다.
5.0 out of 5 stars,Jenny Castaño,https://www.amazon.com/gp/customer-reviews/R8C9T4Q9NO29O/ref=cm_cr_getr_d_rvw_ttl?ie=UTF8&ASIN=B0BN2PX8V3,"5.0 out of 5 stars
 Deep cleaning","I just washed my face and you can tell the difference right away: the skin feels clean, not clumpy, removes waterproof makeup easily without the need to carve too much, I complemented it with the second cleansing step and it's a wonder","https://m.media-amazon.com/images/I/71tj+HquBjL.88.jpg  
",https://images-na.ssl-images-amazon.com/images/G/01/x-locale/common/grey-pixel.gif,"Reviewed in the United States on March 22, 2025",One person found this helpful,Verified Purchase,,5,"세수만 했는데 바로 그 차이를 알 수 있어요. 피부가 뭉침 없이 깨끗하고, 과하게 새기지 않고도 워터프루프 메이크업이 쉽게 지워지고, 2차 클렌징 단계에서 보완했는데 신기하네요."
5.0 out of 5 stars,Gabrielle Tesfaye,https://www.amazon.com/gp/customer-reviews/R2Z5E3KDISAVDK/ref=cm_cr_getr_d_rvw_ttl?ie=UTF8&ASIN=B0BN2PX8V3,"5.0 out of 5 stars
 Love it","Oil cleansing made a huge difference for my skin and this is my favorite one, worth the buy.",,https://images-na.ssl-images-amazon.com/images/G/01/x-locale/common/grey-pixel.gif,"Reviewed in the United States on April 6, 2025",0,Verified Purchase,,5,오일 클렌징은 내 피부에 큰 변화를 가져왔고 이것은 구매할 가치가 있는 제가 가장 좋아하는 제품입니다.
5.0 out of 5 stars,Brooklyn,https://www.amazon.com/gp/customer-reviews/REOU71A1KI4ZH/ref=cm_cr_getr_d_rvw_ttl?ie=UTF8&ASIN=B0BN2PX8V3,"5.0 out of 5 stars
 So far, so good.","It is too soon to be able to give a review on how my skin is looking since ordering this oil cleanser. But, I do love the consistency of the product and how lightweight it feels on my skin. It rinses off well and doesn't leave a lasting oily film on my skin. It seems like it's going to work great for my combination skin.",,https://images-na.ssl-images-amazon.com/images/G/01/x-locale/common/grey-pixel.gif,"Reviewed in the United States on March 14, 2025",3 people found this helpful,Verified Purchase,,5,이 오일 클렌저를 주문한 후 내 피부가 어떤지 리뷰하기에는 너무 이릅니다. 하지만 제품의 지속력과 피부에 닿는 느낌이 얼마나 가벼운지 정말 마음에 듭니다. 잘 헹구어지고 피부에 오래 지속되는 기름진 필름을 남기지 않습니다. 복합성 피부에 아주 잘 맞을 것 같습니다.
5.0 out of 5 stars,Rebecca Farris,https://www.amazon.com/gp/customer-reviews/R1Z22TTN0WIZYA/ref=cm_cr_getr_d_rvw_ttl?ie=UTF8&ASIN=B0BN2PX8V3,"5.0 out of 5 stars
 Best skin care","I was hesitant about this product due to the few one star reviews saying it made their skin break out, and some saying they do not have sensitive skin. I have sensitive skin and when I was using another product locally, I kept breaking out on my chin. With this product however, I haven't broken out at all! The oil cleaner has a tea tree oil scent to it, but it goes on great and removes all my make up just by using my hand and doesn't leave any make up residue when I wash it off, leaving me to use a towel to wipe the rest off. The foaming cleanser, I only have to use a small amount with a little bit of water and that foams up really really well! My face has never felt softer and smoother, even after I use my toner, serums, moisturizer and the SPF (SPF I bought from a anua as well). My chin with other products always felt bumpy even after washing, but now, it's baby soft! Highly recommend to everyone",,"https://images-na.ssl-images-amazon.com/images/S/amazon-avatars-global/8fc9e304-a333-47d7-ba2a-d6b72257a826._CR0,0,374,374_SX48_.jpg","Reviewed in the United States on February 11, 2025",21 people found this helpful,Verified Purchase,,5,"이 제품을 사용하면 피부가 트러블이 난다는 별 1개 리뷰도 있고, 민감성 피부가 아니라는 리뷰도 있어서 망설였습니다. 피부가 예민한데 국소적으로 다른 제품을 사용하다가 턱에 트러블이 계속 났어요. 하지만 이 제품을 사용하면 전혀 무너지지 않았어요! 오일클리너는 티트리오일향이 나지만 지속력이 좋고 손으로만 메이크업을 다 지워주고 세안해도 메이크업 잔여물이 남지 않아서 그냥 놔둬요"
5.0 out of 5 stars,tklmepnk,https://www.amazon.com/gp/customer-reviews/RHGLNZO7XLYV3/ref=cm_cr_getr_d_rvw_ttl?ie=UTF8&ASIN=B0BN2PX8V3,"5.0 out of 5 stars
 Give it a try!","This is my first time using Korean beauty products. I had a skincare routine using mostly Cerave and other drugstore products. I knew I needed to find something different when my skin continued to break out and I had no healthy glow. So I decided to take a chance on Anua.

First of all, I've never had a problem with my skin not being soft. My main problems are continuous breakouts on my forehead and chin area as well as redness under my nose and dull looking skin. I start my routine with this pore cleansing oil. I was skeptical at first because...oil? On my skin? But it smelled so good that I decided to give it a shot. I use just one pump and I massage it on my face for a good couple minutes. After using this for a couple days I did notice my skin was softer and starting to look healthier, but I new I was still missing something. So back to Amazon I went and I got the Anua pore cleansing foam.

After using the pore oil, I rinse and follow up with the Anua pore deep cleansing foam, which also smells nice and clean. I lather it up and massage it on my face while paying special attention to my problem areas. After rinsing and patting my face dry, I can already see such a difference with my skin. After a few uses I was getting some glow back and the redness was fading.

I decided to add more Korean products to my skincare routine and since Anua, I have also added BHA exfoliating toner pads and Madagascar centella ampoule. The BHA pads I use directly after the Anua pore cleansing foam. They have a softer side and a rough side for when you need some extra scrubbing. They smell like tea tree oil, which I don't have a problem with but some people do. After using these I pat my face to let the product soak in. Then I follow up with the Madagascar centella ampoule. This stuff is non scented and must be milk from the heavens because oh my goodness. I thought my face was glowing before using this but after? I look like I was kissed by the morning dew. Seriously face has never looked so healthy. It's soft, it's glowing, I'm very pleased.

My takeaway from using these products is this: give them some time, but for me it didn't take long! I've been using these for maybe two weeks now and I no longer have painful redness under my nose and I haven't had a breakout either. My skin is soft and dewy and wonderful which I noticed after just a couple uses. I am also starting to see my pores look a bit smaller. I'm pretty happy with my switch. I hope you will be too!",,"https://images-na.ssl-images-amazon.com/images/S/amazon-avatars-global/default._CR0,0,1024,1024_SX48_.png","Reviewed in the United States on June 8, 2024",262 people found this helpful,Verified Purchase,,5,"한국 화장품을 처음 써보는데요. 나는 주로 Cerave 및 기타 약국 제품을 사용하여 스킨 케어 루틴을 가졌습니다. 피부가 계속 트러블이 나고 건강한 윤기가 나지 않을 때 뭔가 다른 것을 찾아야 한다는 것을 알았습니다. 그래서 나는 Anua에서 기회를 잡기로 결정했습니다.

우선 피부가 부드러워서 트러블이 난 적은 단 한 번도 없습니다. 저의 가장 큰 문제는 이마와 턱 부분에 지속적인 발진이 생기고 코 밑이 붉어지고 피부가 칙칙해 보이는 것입니다. 내 일상은 이 포로 시작해"
5.0 out of 5 stars,The package was not delivered to me and it says that it is delivered. I need my money back. People who work as delivery people and steal things should be removed from that position,https://www.amazon.com/gp/customer-reviews/R2VKV3Q6U2V6WV/ref=cm_cr_getr_d_rvw_ttl?ie=UTF8&ASIN=B0BN2PX8V3,"5.0 out of 5 stars
 Nice",Okay,,https://images-na.ssl-images-amazon.com/images/G/01/x-locale/common/grey-pixel.gif,"Reviewed in the United States on April 17, 2025",0,Verified Purchase,,5,좋아요
5.0 out of 5 stars,Me,https://www.amazon.com/gp/customer-reviews/ROBYRUVK76QZJ/ref=cm_cr_getr_d_rvw_ttl?ie=UTF8&ASIN=B0BN2PX8V3,"5.0 out of 5 stars
 Good",Perfect,,https://images-na.ssl-images-amazon.com/images/G/01/x-locale/common/grey-pixel.gif,"Reviewed in the United States on April 18, 2025",0,Verified Purchase,,5,완벽한
5.0 out of 5 stars,Lesby barahona,https://www.amazon.com/gp/customer-reviews/R33PL7H8EWF8X/ref=cm_cr_getr_d_rvw_ttl?ie=UTF8&ASIN=B0BN2PX8V3,"5.0 out of 5 stars
 superb",Excellent for cleansing the face,"https://m.media-amazon.com/images/I/71R6ys8A4UL.88.jpg  
",https://images-na.ssl-images-amazon.com/images/G/01/x-locale/common/grey-pixel.gif,"Reviewed in the United States on April 8, 2025",0,Verified Purchase,,5,얼굴 클렌징에 탁월해요
5.0 out of 5 stars,Victoria,https://www.amazon.com/gp/customer-reviews/R2E041NB4RDO18/ref=cm_cr_getr_d_rvw_ttl?ie=UTF8&ASIN=B0BN2PX8V3,"5.0 out of 5 stars
 As advertised",I was skeptical at first that it would actually pull out black heads and sebaceous filaments like I’ve seen on TicTok. The first day it just made my skin look great but the second time I used it I could actually feel and see the specks of buildup on my hands. Highly recommend.,,https://images-na.ssl-images-amazon.com/images/G/01/x-locale/common/grey-pixel.gif,"Reviewed in the United States on March 13, 2025",One person found this helpful,Verified Purchase,,5,처음에는 TicTok에서 본 것처럼 실제로 블랙헤드와 피지 필라멘트를 뽑아낼 수 있을지 회의적이었습니다. 첫날에는 피부가 좋아보였지만 두 번째로 사용했을 때는 실제로 손에 쌓인 얼룩이 느껴지고 눈에 띄었습니다. 적극 추천합니다.
5.0 out of 5 stars,Rosemary,https://www.amazon.com/gp/customer-reviews/R3MN0A854LNDMQ/ref=cm_cr_getr_d_rvw_ttl?ie=UTF8&ASIN=B0BN2PX8V3,"5.0 out of 5 stars
 Works wonders","I have so many white and blackheads. Stubborn blackheads on my chin that never went away, finally went away once I started using this cleansing oil. It’s a staple purchase!",,https://images-na.ssl-images-amazon.com/images/G/01/x-locale/common/grey-pixel.gif,"Reviewed in the United States on March 25, 2025",One person found this helpful,Verified Purchase,,5,화이트헤드와 블랙헤드가 너무 많아요. 턱에 뭉쳐있던 블랙헤드가 사라지지 않던 것이 이 클렌징 오일을 사용하고 나니 드디어 없어졌습니다. 필수구매입니다!
5.0 out of 5 stars,Mayco L.,https://www.amazon.com/gp/customer-reviews/R3CJXO2TILXTS/ref=cm_cr_getr_d_rvw_ttl?ie=UTF8&ASIN=B0BN2PX8V3,"5.0 out of 5 stars
 Became my night-cleanse routine.","Anua oil cleanser was very easy to use! No water needed, just pump, massage the whole face and rinse with water and you’re done!
This is my second bottle. I am the type of person who doesn’t finish a product cause they didnt impressed me and didn’t make a difference in my routine. But this product became a staple in my night time routine.",,https://images-na.ssl-images-amazon.com/images/G/01/x-locale/common/grey-pixel.gif,"Reviewed in the United States on March 9, 2025",4 people found this helpful,Verified Purchase,,5,"아누아 오일 클렌저는 사용하기 매우 쉬웠어요! 물도 필요 없고 펌핑해서 얼굴 전체에 마사지 한 후 물로 헹구기만 하면 끝!
이것은 내 두 번째 병입니다. 나는 제품이 나에게 깊은 인상을 주지 않았고 내 일상에 변화를 주지 않았기 때문에 제품을 완성하지 못하는 유형의 사람입니다. 하지만 이 제품은 내 야간 루틴의 필수품이 되었습니다."
5.0 out of 5 stars,Ami Z.,https://www.amazon.com/gp/customer-reviews/R2SSHDDWN2KTPO/ref=cm_cr_getr_d_rvw_ttl?ie=UTF8&ASIN=B0BN2PX8V3,"5.0 out of 5 stars
 Cloud-like Lather, Dreamy Skin","Do you want silky soft clean skin? The Anua Oil Cleanser delivers a delicate cloud like lather, leaving your skin feeling fresh, hydrated, and deeply cleansed. My face feels so dreamy after I have washed it with Anua. I have used other Korean oil cleansers and the lather is not the same as this brand. From here on out (for oil cleansers), I will only be using Anua!",,https://images-na.ssl-images-amazon.com/images/G/01/x-locale/common/grey-pixel.gif,"Reviewed in the United States on March 5, 2025",2 people found this helpful,Verified Purchase,,5,실크처럼 부드럽고 깨끗한 피부를 원하시나요? 아누아 오일 클렌저는 거품처럼 섬세한 구름을 전달하여 피부를 산뜻하고 촉촉하며 깊게 클렌징해줍니다. 아누아로 세안하고 나면 얼굴이 몽환적인 느낌이 들어요. 나는 다른 한국 오일 클렌저를 사용했는데 거품이 이 브랜드와 동일하지 않습니다. 앞으로는 (오일클렌저로) 아누아만 사용하겠습니다!
5.0 out of 5 stars,Olivia Monaco Hernandez,https://www.amazon.com/gp/customer-reviews/R2WIFAV5CMXJK3/ref=cm_cr_getr_d_rvw_ttl?ie=UTF8&ASIN=B0BN2PX8V3,"5.0 out of 5 stars
 Good",This is great,,https://images-na.ssl-images-amazon.com/images/G/01/x-locale/common/grey-pixel.gif,"Reviewed in the United States on April 13, 2025",0,Verified Purchase,,5,이것은 훌륭하다
5.0 out of 5 stars,emily,https://www.amazon.com/gp/customer-reviews/R3D2VINQ7RF81H/ref=cm_cr_getr_d_rvw_ttl?ie=UTF8&ASIN=B0BN2PX8V3,"5.0 out of 5 stars
 Yes","Love
Smells good
Works great
Have repurchased more than once",,"https://images-na.ssl-images-amazon.com/images/S/amazon-avatars-global/default._CR0,0,1024,1024_SX48_.png","Reviewed in the United States on April 6, 2025",0,Verified Purchase,,5,"사랑
냄새가 좋다
훌륭하게 작동합니다
2번 이상 재구매했습니다"
