Star-rating,Name,Reviewer Profile Url,Review Title,Review Content,images,profile icon,Date,helpful,verified,variant,rating,text_ko
3.0 out of 5 stars,Iza,https://www.amazon.com/gp/customer-reviews/R3544XF1PU2EPV/ref=cm_cr_getr_d_rvw_ttl?ie=UTF8&ASIN=B08CMS8P67,"3.0 out of 5 stars
 Feels good","This feels good on your skin, but it feels like water? I don't know if it really does anything for my skin, but it feels refreshing to me",,https://images-na.ssl-images-amazon.com/images/G/01/x-locale/common/grey-pixel.gif,"Reviewed in the United States on October 21, 2024",0,Verified Purchase,Scent: UnscentedSize: 8.45 Fl Oz (Pack of 1),3,피부에 닿는 느낌은 좋은데 물같은 느낌? 피부에 정말 좋을지는 모르겠지만 상쾌한 느낌이에요
3.0 out of 5 stars,Jessica,https://www.amazon.com/gp/customer-reviews/R3KXK1Y0LE49IQ/ref=cm_cr_getr_d_rvw_ttl?ie=UTF8&ASIN=B08CMS8P67,"3.0 out of 5 stars
 MADE NO DIFFERENCE",I finished a bottle. I did notice it helped clean whatever my cleanser didn't get off in the mornings. But anything can do that so this toner was not a must for me and I will be looking for something else that can do more now.,,"https://images-na.ssl-images-amazon.com/images/S/amazon-avatars-global/default._CR0,0,1024,1024_SX48_.png","Reviewed in the United States on July 22, 2024",0,Verified Purchase,Scent: UnscentedSize: 8.45 Fl Oz (Pack of 1),3,나는 한 병을 다 마셨다. 나는 아침에 클렌저가 지워지지 않은 모든 것을 청소하는 데 도움이 된다는 것을 알았습니다. 하지만 무엇이든 그렇게 할 수 있으므로 이 토너는 나에게 필수품이 아니었고 이제 더 많은 일을 할 수 있는 다른 것을 찾을 것입니다.
3.0 out of 5 stars,AM,https://www.amazon.com/gp/customer-reviews/R1I8UKD13KM3PH/ref=cm_cr_getr_d_rvw_ttl?ie=UTF8&ASIN=B08CMS8P67,"3.0 out of 5 stars
 My rosacea skin didn't like",I really wanted to like this based on reviews but my rosacea prone skin just didn't like it and I was flushing more after a few days of use. Stopped and the redness immediately went away. Didn't seem to help moisturize either. Worth a try but it just didn't work for me.,,"https://images-na.ssl-images-amazon.com/images/S/amazon-avatars-global/default._CR0,0,1024,1024_SX48_.png","Reviewed in the United States on June 12, 2024",9 people found this helpful,Verified Purchase,Scent: UnscentedSize: 8.45 Fl Oz (Pack of 1),3,나는 리뷰를 기반으로 이것을 정말로 좋아하고 싶었지만 장미증이 발생하기 쉬운 피부가 마음에 들지 않았고 며칠 사용 후 더 많이 붉어졌습니다. 멈추고 붉은기가 즉시 사라졌습니다. 보습에도 별 도움이 안 되는 것 같았어요. 시도해 볼 가치가 있지만 나에게는 효과가 없었습니다.
3.0 out of 5 stars,John,https://www.amazon.com/gp/customer-reviews/R1MFNQN2MFD4Y/ref=cm_cr_getr_d_rvw_ttl?ie=UTF8&ASIN=B08CMS8P67,"3.0 out of 5 stars
 Overhyped, but pretty good!","This product to me was pretty average. I think I can see why it went viral - for people who haven't ever tried gentle Korean toner formulations I'm sure it was super nice, but for those of us that are use to them I don't see this as being a truly stand out product. It's very similar to all of the other toners out there as far as soothing and anti-irritation goes. I will say that this might be one of the better values, as you get a tone of product!",,"https://images-na.ssl-images-amazon.com/images/S/amazon-avatars-global/d3bef6ef-cf31-4c5b-b421-bc941dca83de._CR69,0,361,361_SX48_.jpg","Reviewed in the United States on February 22, 2024",0,Verified Purchase,Scent: UnscentedSize: 8.45 Fl Oz (Pack of 1),3,"나에게 이 제품은 꽤 평범했다. 왜 입소문이 났는지 알 것 같습니다. 순한 한국 토너 제제를 사용해 본 적이 없는 사람들에게는 그것이 매우 좋았을 것이라고 확신하지만, 그것에 익숙한 우리에게는 이것이 진정으로 눈에 띄는 제품이라고 생각하지 않습니다. 진정 및 자극 방지에 관한 한 다른 모든 토너와 매우 유사합니다. 나는 이것이 제품의 톤을 얻을 때 더 나은 가치 중 하나라고 말할 것입니다!"
3.0 out of 5 stars,Loraine,https://www.amazon.com/gp/customer-reviews/R1389Q5Y40C1YE/ref=cm_cr_getr_d_rvw_ttl?ie=UTF8&ASIN=B08CMS8P67,"3.0 out of 5 stars
 Not sure what all the hype is?","I’ve heard so many amazing things about this toner, and now that I’m using it I am wondering why.
I mean, it’s not bad. It makes my face feel smooth after I use it, but I don’t get the clean feeling most toner gives me.
It’s actually been unremarkable enough so that I forget to use it.
I’ll be going back to my regular brand.",,"https://images-na.ssl-images-amazon.com/images/S/amazon-avatars-global/default._CR0,0,1024,1024_SX48_.png","Reviewed in the United States on May 17, 2024",0,Verified Purchase,Scent: UnscentedSize: 8.45 Fl Oz (Pack of 1),3,"이 토너에 대해 놀라운 이야기를 많이 들었는데, 이제 사용하고 보니 그 이유가 무엇인지 궁금합니다.
내 말은, 나쁘지 않은데. 사용하고 나면 얼굴이 매끄러워지는 느낌이 들지만 대부분의 토너가 주는 깔끔한 느낌은 없어요.
실제로는 사용하는 것을 잊어버릴 정도로 눈에 띄지 않았습니다.
나는 나의 정규 브랜드로 돌아갈 것이다."
3.0 out of 5 stars,Denise,https://www.amazon.com/gp/customer-reviews/R29FIVABND6DC9/ref=cm_cr_getr_d_rvw_ttl?ie=UTF8&ASIN=B08CMS8P67,"3.0 out of 5 stars
 Not the best thing","I bought this toner only because everyone hypes it up so much. Don’t get me wrong its a nice toner but it did barely anything to my skin, it’s basically water. I love their cleansing oil had high hopes for this product but felt let down now.",,https://images-na.ssl-images-amazon.com/images/G/01/x-locale/common/grey-pixel.gif,"Reviewed in the United States on April 30, 2024",10 people found this helpful,Verified Purchase,Scent: UnscentedSize: 8.45 Fl Oz (Pack of 1),3,다들 너무 좋다고 해서 이 토너를 구매했어요. 오해하지 마십시오. 좋은 토너이지만 피부에는 거의 영향을 미치지 않았습니다. 기본적으로 물입니다. 나는 그들의 클렌징 오일을 좋아합니다. 이 제품에 대한 기대가 높았지만 지금은 실망했습니다.
3.0 out of 5 stars,Works good,https://www.amazon.com/gp/customer-reviews/R9P4TQZ03QUMT/ref=cm_cr_getr_d_rvw_ttl?ie=UTF8&ASIN=B08CMS8P67,"3.0 out of 5 stars
 Doesn't see effects",I use it daily and don't see the effects of what it's supposed to do. I only got toner bc my spa facial teacher told me to.,,https://images-na.ssl-images-amazon.com/images/G/01/x-locale/common/grey-pixel.gif,"Reviewed in the United States on July 17, 2024",2 people found this helpful,Verified Purchase,Scent: UnscentedSize: 8.45 Fl Oz (Pack of 1),3,나는 그것을 매일 사용하지만 그것이 해야 할 일의 효과를 보지 못합니다. 스파 페이셜 선생님이 하라고 해서 토너만 받았어요.
3.0 out of 5 stars,ava,https://www.amazon.com/gp/customer-reviews/R2DU4M4SADJP61/ref=cm_cr_getr_d_rvw_ttl?ie=UTF8&ASIN=B08CMS8P67,"3.0 out of 5 stars
 Didn't Work","Sure, it left my skin feeling smoother than if I didn't use it, but it didn't hydrate, refresh, or calm my skin as it claims to. Idk man 🤷‍♀️",,https://images-na.ssl-images-amazon.com/images/G/01/x-locale/common/grey-pixel.gif,"Reviewed in the United States on August 1, 2024",0,Verified Purchase,Scent: UnscentedSize: 8.45 Fl Oz (Pack of 1),3,"물론, 사용하지 않았을 때보다 피부가 더 매끄러워졌지만, 주장대로 피부에 수분을 공급하거나 상쾌하게 하거나 진정시키지는 못했습니다. 나도 몰라 🤷‍♀️"
3.0 out of 5 stars,Ana Diaz,https://www.amazon.com/gp/customer-reviews/R2AT8CK2G7FYH/ref=cm_cr_getr_d_rvw_ttl?ie=UTF8&ASIN=B08CMS8P67,"3.0 out of 5 stars
 Tenía más expectativas",Es de aroma agradable y se siente fresco en la piel. Realmente no aprecio ninguna diferencia o aporte.,,https://images-na.ssl-images-amazon.com/images/G/01/x-locale/common/grey-pixel.gif,"Reviewed in the United States on July 20, 2024",0,Verified Purchase,Scent: UnscentedSize: 8.45 Fl Oz (Pack of 1),3,아로마는 분해 가능하며 프레스코화로 제작됩니다. Realmente no aprecio ninguna diferencia o aporte.
3.0 out of 5 stars,tuxedocat858,https://www.amazon.com/gp/customer-reviews/R1OV8948USA1EB/ref=cm_cr_getr_d_rvw_ttl?ie=UTF8&ASIN=B08CMS8P67,"3.0 out of 5 stars
 Fake?","I did my research ahead of time from social media + business name/address, however, I don't think I got the real product. I did not have the clearest skin to begin with, I'll admit, but I've consistently used it over the last couple months to see if it would help my redness/rosacea. It did not help the rosacea, and made me break out progressively - everywhere on my face. I had a couple pimples on my forehead to start, now I've accumulated 10+ acne scars around my forehead, cheeks, and chin.

I have purchased this again, but through Olive Young, hoping for the results I've been looking for!",,https://images-na.ssl-images-amazon.com/images/G/01/x-locale/common/grey-pixel.gif,"Reviewed in the United States on October 22, 2023",3 people found this helpful,Verified Purchase,Scent: UnscentedSize: 8.45 Fl Oz (Pack of 1),3,"소셜 미디어 + 업체 이름/주소를 통해 미리 조사했지만 실제 제품을 얻지 못한 것 같습니다. 나는 처음부터 피부가 가장 깨끗하지 않았다는 것을 인정합니다. 그러나 나는 그것이 나의 발적/주사증에 도움이 될지 알아보기 위해 지난 몇 달 동안 지속적으로 그것을 사용해 왔습니다. 그것은 장미증에 도움이 되지 않았고 얼굴 전체에 점차적으로 발진이 생겼습니다. 처음에는 이마에 여드름이 두 개나 있었는데, 지금은 이마, 볼, 턱 주위에 여드름 흉터가 10개 이상 쌓였습니다.

나는 h"
3.0 out of 5 stars,Maria A.,https://www.amazon.com/gp/customer-reviews/R38GOW15STT5P1/ref=cm_cr_getr_d_rvw_ttl?ie=UTF8&ASIN=B08CMS8P67,"3.0 out of 5 stars
 It’s ok",Was recommended this product but it worked it first but suddenly I started to break out way harder. So I’m in between. The skin feels nice and clean but it’s just the breakout that I got after a while.,,https://images-na.ssl-images-amazon.com/images/G/01/x-locale/common/grey-pixel.gif,"Reviewed in the United States on April 17, 2024",2 people found this helpful,Verified Purchase,Scent: UnscentedSize: 8.45 Fl Oz (Pack of 1),3,이 제품을 추천받았지만 처음에는 효과가 있었지만 갑자기 훨씬 더 힘들어지기 시작했습니다. 그래서 나는 그 사이에 있습니다. 피부가 좋고 깨끗한 느낌이 들지만 시간이 좀 지나서 생긴 트러블일 뿐입니다.
3.0 out of 5 stars,Stacy,https://www.amazon.com/gp/customer-reviews/R11T3L919ESA81/ref=cm_cr_getr_d_rvw_ttl?ie=UTF8&ASIN=B08CMS8P67,"3.0 out of 5 stars
 Refreshing but okay","Refreshing toner that I liked but didn't love. Nice and thin and absorbed quickly into the skin. The only reason why I'm giving a 3 is because their pore cleansing oil and foam didn't work out for me. I'm not sure if it's heartleaf itself that I am allergic to or other ingredients, but I couldn't risk to keep using it.",,"https://images-na.ssl-images-amazon.com/images/S/amazon-avatars-global/default._CR0,0,1024,1024_SX48_.png","Reviewed in the United States on February 26, 2024",0,Verified Purchase,Scent: UnscentedSize: 8.45 Fl Oz (Pack of 1),3,좋아했지만 좋아하지 않았던 산뜻한 토너. 얇고 얇고 피부에 빠르게 흡수됩니다. 3점을 준 유일한 이유는 모공 클렌징 오일과 폼이 나에게 맞지 않았기 때문입니다. 내가 알레르기를 일으키는 것이 하트잎 자체인지 다른 성분인지는 잘 모르겠지만 계속 사용하는 것은 위험할 수 없습니다.
3.0 out of 5 stars,Mom amazoner,https://www.amazon.com/gp/customer-reviews/R3TSLDQ9J1HX24/ref=cm_cr_getr_d_rvw_ttl?ie=UTF8&ASIN=B08CMS8P67,"3.0 out of 5 stars
 Not sure if it’s right for my skin type","I’m an acne prone skin type and I have been trying to find products that are calming for my acne prone skin. I’m not sure if this is the right product for me, but that’s not to say it isn’t the right product for someone else. Overall it does feel nice on the skin and doesn’t leave any strange residue. I might try and reintroduce it after my skin calms down a little more.",,"https://images-na.ssl-images-amazon.com/images/S/amazon-avatars-global/default._CR0,0,1024,1024_SX48_.png","Reviewed in the United States on January 8, 2024",0,Verified Purchase,Scent: UnscentedSize: 8.45 Fl Oz (Pack of 1),3,"저는 여드름이 나는 피부 타입이고 여드름이 나는 피부를 진정시켜주는 제품을 찾으려고 노력해 왔습니다. 이 제품이 나에게 적합한지 확신할 수 없지만, 그렇다고 다른 사람에게 적합한 제품이 아니라는 의미는 아닙니다. 전반적으로 피부에 닿는 느낌이 좋고 이상한 잔여물이 남지 않습니다. 피부가 좀 진정된 후에 다시 시도해볼 수도 있겠네요."
3.0 out of 5 stars,Zoe,https://www.amazon.com/gp/customer-reviews/R3ITKK9E3RDKEH/ref=cm_cr_getr_d_rvw_ttl?ie=UTF8&ASIN=B08CMS8P67,"3.0 out of 5 stars
 Sobrevalorado","Pienso que está sobrevalorado. Me gusta su olor, es un producto bien simple. No siento que hidrate tanto. Pero si ayuda con redness. Disminuye el rojo de mi cara. Mi cara es bien sensitiva y reacciona mal ante cualquier producto, puedo decir que con este no tuvo ninguna reacción. Pero tampoco veo que haya hecho alguna diferencia en ella. Solo se siente bienal hecharlo, pero no veo cambios",,"https://images-na.ssl-images-amazon.com/images/S/amazon-avatars-global/default._CR0,0,1024,1024_SX48_.png","Reviewed in the United States on February 19, 2024",One person found this helpful,Verified Purchase,Scent: UnscentedSize: 8.45 Fl Oz (Pack of 1),3,"그래서 당신은 그렇게 생각합니다. Me gusta su olor, es un producto bien simple. No siento que hidrate tanto. Pero si ayuda con redness. Disminuye el rojo de mi cara. Mi cara es bien sensitiva y reacciona mal ante cualquier producto, puedo decir que con este no tuvo ninguna reacción. Pero tampoco veo que haya hecho alguna diferencia en ella. Solo se siente bienal hecharlo, pero no veo cambios"
3.0 out of 5 stars,Joe Diaz,https://www.amazon.com/gp/customer-reviews/R1DT4AKPPR7510/ref=cm_cr_getr_d_rvw_ttl?ie=UTF8&ASIN=B08CMS8P67,"3.0 out of 5 stars
 Very skeptical","Click to play video
Still on my first week with this product but I can't shake the feeling this product was tampered with. The box came dirty and a little scuffed up, seems like the sticker on the bottom of the box was peeled off and placed back because it peeled off right away.

Consistency of the product itself is lightweight, it is absorbed into my skin right away. No smell. I don't think I would purchase from this store again, I'd probably google a wholesale or go with Jolse.","https://m.media-amazon.com/images/I/51NphkIReqL.88.jpg  
","https://images-na.ssl-images-amazon.com/images/S/amazon-avatars-global/default._CR0,0,1024,1024_SX48_.png","Reviewed in the United States on September 10, 2023",7 people found this helpful,Verified Purchase,Scent: UnscentedSize: 8.45 Fl Oz (Pack of 1),3,"동영상을 재생하려면 클릭하세요.
아직 이 제품을 사용한 첫 주이지만 이 제품이 조작되었다는 느낌을 지울 수 없습니다. 상자가 더러워지고 조금 긁혀서 왔는데, 상자 밑면에 붙은 스티커가 벗겨졌다가 바로 벗겨져서 다시 넣은 것 같습니다.

제품 자체의 지속력은 가벼워서 피부에 바로 흡수됩니다. 냄새가 없습니다. 다시는 이 상점에서 구매할 생각이 없습니다. 아마도 Google에서 도매로 검색하거나 Jolse를 선택하겠습니다."
3.0 out of 5 stars,Erika Ramsey,https://www.amazon.com/gp/customer-reviews/R1NZEFX6X6AC6Q/ref=cm_cr_getr_d_rvw_ttl?ie=UTF8&ASIN=B08CMS8P67,"3.0 out of 5 stars
 Be Aware and Careful!","So it seems like this product is not suitable for all skin types so please be cautious when purchasing! I really tried to like this product because my friend is also a big fan, but when I used it I got red bumps from my face all the way to my neck. If you are allergic to any of the ingredients or have sensitive skin, I would be cautious when buying or using this product.",,https://images-na.ssl-images-amazon.com/images/G/01/x-locale/common/grey-pixel.gif,"Reviewed in the United States on January 24, 2024",2 people found this helpful,Verified Purchase,Scent: UnscentedSize: 8.45 Fl Oz (Pack of 1),3,"그래서 이 제품은 모든 피부타입에 적합하지 않은 것 같으니 구매시 주의해주세요! 친구도 이 제품을 너무 좋아해서 너무 맘에 들어했는데 사용해보니 얼굴부터 목까지 붉은 돌기가 생겼어요. 어떤 성분에 알레르기가 있거나 민감한 피부를 가지고 계시다면, 이 제품을 구입하거나 사용할 때 주의가 필요합니다."
3.0 out of 5 stars,Kethan S.,https://www.amazon.com/gp/customer-reviews/RYLNTZSOVQ4OV/ref=cm_cr_getr_d_rvw_ttl?ie=UTF8&ASIN=B08CMS8P67,"3.0 out of 5 stars
 [UPDATED] initially hydrating, but irritating if layered on","UPDATE: I have since stopped using this toner since my skin began to feel very irritated, likely due to the sugar cane extract. Please exercise caution, depending on how many times you use it your skin may feel lacking or very hydrated, but at the cost of your barrier if you’re sensitive.

Initial review:

Currently halfway through the bootle, and I've been enjoying the benefits of it so far. This toner has been very hydrating and soothing for my skin, and I have yet to have any significant breakouts as of far. I use this day and night followed by my treatments and then lock in with moisturizer.",,https://images-na.ssl-images-amazon.com/images/G/01/x-locale/common/grey-pixel.gif,"Reviewed in the United States on July 25, 2023",3 people found this helpful,Verified Purchase,Scent: UnscentedSize: 8.45 Fl Oz (Pack of 1),3,"업데이트: 사탕수수 추출물로 인해 피부가 매우 자극을 받기 시작한 이후로 이 토너 사용을 중단했습니다. 사용 횟수에 따라 피부가 부족하거나 수분이 부족한 느낌을 받을 수 있지만, 예민한 경우에는 장벽이 손상될 수 있으므로 주의하시기 바랍니다.

초기 검토:

현재 부틀의 절반 정도가 지났고 지금까지 그 혜택을 누리고 있습니다. 이 토너는 피부에 매우 수분을 공급하고 진정시켜 주었고 아직 큰 호흡이 없었습니다."
3.0 out of 5 stars,Spencer,https://www.amazon.com/gp/customer-reviews/RGQC5HLZDXMZO/ref=cm_cr_getr_d_rvw_ttl?ie=UTF8&ASIN=B08CMS8P67,"3.0 out of 5 stars
 eh",This was over hyped on tiktok for me. Felt like it didn’t do much at all for my skin and may have even irritated my barrier. It was a mediocre consistency and don’t understand why it’s so loved. It felt too acidic for my skin.,,https://images-na.ssl-images-amazon.com/images/G/01/x-locale/common/grey-pixel.gif,"Reviewed in the United States on March 26, 2024",0,Verified Purchase,Scent: UnscentedSize: 8.45 Fl Oz (Pack of 1),3,이것은 나를 위해 tiktok에서 지나치게 과장되었습니다. 내 피부에 전혀 효과가 없는 것 같았고 심지어 내 장벽을 자극했을 수도 있습니다. 평범한 일관성이었고 왜 그렇게 사랑 받는지 이해하지 못합니다. 내 피부에는 너무 산성인 것 같았어요.
3.0 out of 5 stars,NellieNels,https://www.amazon.com/gp/customer-reviews/R39PGHE2ENVZPG/ref=cm_cr_getr_d_rvw_ttl?ie=UTF8&ASIN=B08CMS8P67,"3.0 out of 5 stars
 Good.",Iv been using this for about 3months now. Not sure if it’s really made a big difference in my skin. I have a lot of dark marks and I thought this toner would lighten it up more…. Maybe I need to be more consistent. Not bad tho,,https://images-na.ssl-images-amazon.com/images/G/01/x-locale/common/grey-pixel.gif,"Reviewed in the United States on March 19, 2024",0,Verified Purchase,Scent: UnscentedSize: 8.45 Fl Oz (Pack of 1),3,저는 이것을 약 3개월 동안 사용해 왔습니다. 그것이 실제로 내 피부에 큰 변화를 가져왔는지 확실하지 않습니다. 제가 어두운 부분이 많은데 이 토너를 사용하면 좀 더 밝아질 줄 알았는데… 아마도 좀 더 일관성을 유지해야 할 것 같습니다. 나쁘지는 않은데
3.0 out of 5 stars,Tiffany tests,https://www.amazon.com/gp/customer-reviews/R12IJO5BMGC76V/ref=cm_cr_getr_d_rvw_ttl?ie=UTF8&ASIN=B08CMS8P67,"3.0 out of 5 stars
 No sé por qué este tónico es viral","Hace más de un año compré este tónico y he visto que ahora es viral. Mi piel es sensible, con tendencia al acné y deshidratada. Este tónico lo usé como sheet mask y usando el método de las 7 capas de tónico pero siempre se sentía como agua y ya. No hidrata para nada, prefiero mil veces el tónico Soon Jung de Etude House, ese sí es un buen tónico hidratante y con propiedades antioxidantes.
No considero agradable gastar tanto dinero en un tónico que debe usarse más de 7 veces para sentirlo hidratante.",,https://images-na.ssl-images-amazon.com/images/G/01/x-locale/common/grey-pixel.gif,"Reviewed in the United States on August 16, 2023",0,Verified Purchase,Scent: UnscentedSize: 8.45 Fl Oz (Pack of 1),3,"당신은 자신의 입소문에 대해 이야기하고 싶어합니다. Mi piel es sensible, con tendencia al acné y deshidratada. Este tónico lo usé como 시트 마스크 y usando el método de las 7 capas de tónico pero siempre se sentía como agua y ya. No hidrata para nada, prefiero mil veces el tónico Soon Jung de Etude House, ese sí es un buen tónico hidratante y con propiedades 항산화제.
분해 가능한 가스타르 탄토 dinero en un tónico que debe usarse más de 7 veces para sentirlo hidrata를 고려하지 않음"
3.0 out of 5 stars,Tara Mcfee,https://www.amazon.com/gp/customer-reviews/RG62YFPPGF5IW/ref=cm_cr_getr_d_rvw_ttl?ie=UTF8&ASIN=B08CMS8P67,"3.0 out of 5 stars
 Wanted to love",I’m not sure how long I’m supposed to use it before noticing a difference but I used it every day for 30 days at least and I just don’t think it’s doing anything?,,https://images-na.ssl-images-amazon.com/images/G/01/x-locale/common/grey-pixel.gif,"Reviewed in the United States on March 16, 2024",One person found this helpful,Verified Purchase,Scent: UnscentedSize: 8.45 Fl Oz (Pack of 1),3,얼마나 오래 사용해야 차이를 느낄 수 있을지 잘 모르겠지만 적어도 30일 동안 매일 사용했는데 아무 효과가 없는 것 같나요?
3.0 out of 5 stars,VMVA,https://www.amazon.com/gp/customer-reviews/R2LFQ4LP6WF7LM/ref=cm_cr_getr_d_rvw_ttl?ie=UTF8&ASIN=B08CMS8P67,"3.0 out of 5 stars
 Not sure if it's working",I purchased this on a recommendation. It has no smell and doesn't feel like anything other than water. The only reason I know it's not water is because I had a cut on my face and it stung a little. I see/feel no changes so far.,,"https://images-na.ssl-images-amazon.com/images/S/amazon-avatars-global/default._CR0,0,1024,1024_SX48_.png","Reviewed in the United States on March 18, 2024",0,Verified Purchase,Scent: UnscentedSize: 8.45 Fl Oz (Pack of 1),3,추천으로 구매했습니다. 냄새도 없고 물 외에 다른 느낌도 없습니다. 물이 아니라는 걸 아는 유일한 이유는 얼굴에 상처가 나서 조금 따가웠기 때문이에요. 지금까지 아무런 변화가 보이지/느껴지지 않습니다.
3.0 out of 5 stars,Mindy Cha,https://www.amazon.com/gp/customer-reviews/R342676I575IMF/ref=cm_cr_getr_d_rvw_ttl?ie=UTF8&ASIN=B08CMS8P67,"3.0 out of 5 stars
 I broke out because of it","I did like how it felt after using it, so I used it for a couple weeks. During those couple of weeks, I started breaking out on my chin and nose.
I was confused because I don’t usually break out like that. So, just to experiment, I stopped using the product for 2 weeks.
I wasn’t breaking out anymore after that.

I have a combination skin type. So it may not work as well for combination skin types.",,"https://images-na.ssl-images-amazon.com/images/S/amazon-avatars-global/default._CR0,0,1024,1024_SX48_.png","Reviewed in the United States on November 17, 2023",3 people found this helpful,Verified Purchase,Scent: UnscentedSize: 8.45 Fl Oz (Pack of 1),3,"사용 후 느낌이 너무 좋아서 몇 주 동안 사용했어요. 그 몇 주 동안 나는 턱과 코에 발진이 생기기 시작했습니다.
평소에는 그런 식으로 헤어지지 않아서 헷갈렸어요. 그래서 그냥 실험삼아 2주 동안 제품 사용을 중단했습니다.
그 이후에는 더 이상 헤어지지 않았습니다.

나는 복합성 피부 타입을 가지고 있습니다. 따라서 복합성 피부에는 효과가 없을 수도 있습니다."
3.0 out of 5 stars,msal0208,https://www.amazon.com/gp/customer-reviews/R34M84CZTLBQLR/ref=cm_cr_getr_d_rvw_ttl?ie=UTF8&ASIN=B08CMS8P67,"3.0 out of 5 stars
 ehh",it’s not as good as everyone says. kinda feels like it leaves my skin oily. didn’t really like this toner. there’s better .,,"https://images-na.ssl-images-amazon.com/images/S/amazon-avatars-global/9987a827-9e5f-4228-b40f-2f988ad0f287._CR24,0,451,451_SX48_.jpg","Reviewed in the United States on April 28, 2024",One person found this helpful,Verified Purchase,Scent: UnscentedSize: 8.45 Fl Oz (Pack of 1),3,모두가 말하는 것처럼 좋지는 않습니다. 왠지 피부가 기름진 것 같은 느낌이 들어요. 이 토너는 별로 마음에 들지 않았어요. 더 좋습니다.
