Star-rating,Name,Reviewer Profile Url,Review Title,Review Content,images,profile icon,Date,helpful,verified,variant,rating,text_ko
2.0 out of 5 stars,broke my,https://www.amazon.com/gp/customer-reviews/R2LYPSDV4MJUHK/ref=cm_cr_getr_d_rvw_ttl?ie=UTF8&ASIN=B0BN2PX8V3,"2.0 out of 5 stars
 made my skin breakout","i was using a different oil cleanser which worked amazingly but was pretty expensive so i decided to give this one a try. i’ve only been using it for three months but my skin is destroyed, i have pimples all over my forehead & even under my brows/near my eyelids. im talking about deep painful pimples that can’t be removed with pimple patches, i currently have six. this wasn’t a problem before, not only that but my blackheads have not gotten any better. it’s good at removing makeup but that’s about it for me. i have a dehydrated/dry skin type, btw.",,https://images-na.ssl-images-amazon.com/images/G/01/x-locale/common/grey-pixel.gif,"Reviewed in the United States on March 15, 2024",0,Verified Purchase,,2,"나는 놀랍도록 효과가 있는 다른 오일 클렌저를 사용하고 있었지만 꽤 비싸서 이것을 사용해 보기로 결정했습니다. 사용한 지 3개월밖에 안 됐는데 피부가 망가지고, 이마 전체는 물론이고 눈썹 아래/눈꺼풀 근처에도 여드름이 생겼어요. 나는 여드름 패치로 제거할 수 없는 깊고 고통스러운 여드름에 대해 이야기하고 있는데, 현재 6개가 있습니다. 전에는 별 문제가 아니었는데, 그뿐만 아니라 블랙헤드도 전혀 나아지지 않았어요. 화장 지우는 건 좋은데 그건 별로야"
2.0 out of 5 stars,Natajah Kelley,https://www.amazon.com/gp/customer-reviews/R14SCW0WDANKG5/ref=cm_cr_getr_d_rvw_ttl?ie=UTF8&ASIN=B0BN2PX8V3,"2.0 out of 5 stars
 Damaged when received","I haven’t gotten a chance to try to product and by the time I’ll be able to return it it’ll be too late. When I received my package the box was stained with oil. I figured it was this product, when I opened it the products box and plastic wrapping were covered in oil. As you can see in the video the lid was not on the product properly causing it to spill everywhere. This bottle was $27 and now the price has been brought down. 😒",,https://images-na.ssl-images-amazon.com/images/G/01/x-locale/common/grey-pixel.gif,"Reviewed in the United States on June 25, 2024",One person found this helpful,Verified Purchase,,2,아직 제품을 사용해 볼 기회가 없었고 반품할 수 있을 때쯤이면 너무 늦을 것입니다. 패키지를 받았을 때 상자가 기름으로 얼룩져 있었습니다. 이 제품인 줄 알고 열어보니 제품 상자와 비닐 포장이 기름으로 뒤덮여 있었습니다. 영상에서 볼 수 있듯이 제품 뚜껑이 제대로 닫히지 않아 제품이 여기저기 쏟아졌습니다. 이 병은 27달러였는데 지금은 가격이 인하되었습니다. 😒
2.0 out of 5 stars,claudia sloboda,https://www.amazon.com/gp/customer-reviews/R3TNRAS9AJ5EHA/ref=cm_cr_getr_d_rvw_ttl?ie=UTF8&ASIN=B0BN2PX8V3,"2.0 out of 5 stars
 I wanted to love this…",I bought this because I had seen so many good reviews! My skin is pretty clear but has the typical blackhead and sebaceous filaments that I wanted rid of. And I read that a cleansing oil like this would help. Unfortunately this caused my skin to have so much texture and clog my pores more than before! I have read that this contains some pore clogging ingredients:/ the reaction to this product was almost instant. I also was forming tiny bumps on my eyelids from this as well. I had to stop using after three uses:( maybe it will work for someone else but unfortunately not me.,,https://images-na.ssl-images-amazon.com/images/G/01/x-locale/common/grey-pixel.gif,"Reviewed in the United States on March 1, 2024",2 people found this helpful,Verified Purchase,,2,"후기가 너무 좋아서 구매했어요! 내 피부는 꽤 깨끗하지만, 제가 없애고 싶었던 전형적인 블랙헤드와 피지 필라멘트가 있습니다. 그리고 이런 클렌징 오일이 도움이 된다는 글을 읽었습니다. 불행하게도 이로 인해 내 피부는 질감이 너무 좋아졌고 이전보다 모공이 더 많이 막혔습니다! 나는 여기에 모공을 막는 성분이 포함되어 있다는 것을 읽었습니다./ 이 제품에 대한 반응은 거의 즉각적이었습니다. 나는 또한 이것 때문에 눈꺼풀에 작은 돌기를 형성하고 있었습니다. 나는 사용을 중단해야했다"
2.0 out of 5 stars,Crareds,https://www.amazon.com/gp/customer-reviews/R1C4G3TP3WUKAA/ref=cm_cr_getr_d_rvw_ttl?ie=UTF8&ASIN=B0BN2PX8V3,"2.0 out of 5 stars
 It's good but...","I have oily skin and although when I use it, it has cleansed me very well and has closed my pores, I have also noticed that acne (black and white spots) has increased. I try not to use it every day but when I have very strong makeup.","https://m.media-amazon.com/images/I/610Ja+XaLQL.88.jpg  
https://m.media-amazon.com/images/I/61DmgS8JcIL.88.jpg  
","https://images-na.ssl-images-amazon.com/images/S/amazon-avatars-global/default._CR0,0,1024,1024_SX48_.png","Reviewed in the United States on August 17, 2024",2 people found this helpful,Verified Purchase,,2,저는 지성피부인데 사용하면 클렌징이 잘되고 모공이 닫히는데도 여드름(흑백반점)이 늘어난 걸 느꼈어요. 매일은 사용하지 않고 메이크업이 아주 강렬할 때 사용하려고 노력하고 있어요.
2.0 out of 5 stars,Amazon Customer,https://www.amazon.com/gp/customer-reviews/RNRGQ2NMTKNPE/ref=cm_cr_getr_d_rvw_ttl?ie=UTF8&ASIN=B0BN2PX8V3,"2.0 out of 5 stars
 Subpar cleansing oil",It’s extremely watery and is terrible at emulsifying. I’m only giving it 2 stars because it doesn’t have an unpleasant smell.,,"https://images-na.ssl-images-amazon.com/images/S/amazon-avatars-global/default._CR0,0,1024,1024_SX48_.png","Reviewed in the United States on October 27, 2024",0,Verified Purchase,,2,극도로 물기가 많고 유화력이 형편없습니다. 불쾌한 냄새가 나지 않아서 별 2개만 드립니다.
2.0 out of 5 stars,Gilkah Argueta,https://www.amazon.com/gp/customer-reviews/R1O4IAHJ6CS2KB/ref=cm_cr_getr_d_rvw_ttl?ie=UTF8&ASIN=B0BN2PX8V3,"2.0 out of 5 stars
 Not as good as advertised","I saw this product a lot on tiktok, it was trending a lot and it seemed to remove sebum well so i decided to purchase. Do Not Recommend. Definitely do your research first! This product may have worked well for some people but it wasnt for me. I have combo acne prone skin and this product was not great. It has pore clogging ingredients which means it can break you out and it caused small breakout for me by the side of my face. It does remove sebum though and pores. It does have fragrance so would not be best for sensitive skin. It also dries me out a bit surprisingly.",,"https://images-na.ssl-images-amazon.com/images/S/amazon-avatars-global/default._CR0,0,1024,1024_SX48_.png","Reviewed in the United States on February 10, 2024",0,Verified Purchase,,2,틱톡에서 이 제품 많이 봤는데 트렌드도 많이 있고 피지 제거도 잘 되는 것 같아서 구매하게 됐어요. 권장하지 않음. 확실히 먼저 조사를 해보세요! 이 제품은 어떤 사람들에게는 효과가 좋았을 수도 있지만 나에게는 그렇지 않았습니다. 나는 복합성 여드름 피부를 가지고 있는데 이 제품은 좋지 않았습니다. 그것은 모공을 막는 성분을 가지고 있어 당신을 깨뜨릴 수 있고 내 얼굴 옆에 작은 발진을 ​​일으켰습니다. 그래도 피지와 모공은 제거해줍니다. 향이 있어서 그렇겠지.
2.0 out of 5 stars,Reilly,https://www.amazon.com/gp/customer-reviews/R2GQF2TWR8XWFZ/ref=cm_cr_getr_d_rvw_ttl?ie=UTF8&ASIN=B0BN2PX8V3,"2.0 out of 5 stars
 Fell into the influencer trap…","This brand is being heavily pushed on TikTok and I totally fell for the influencer trap. I’ve used way better facial oils compared to this, such as DHC Cleansing Oil, which is much more effective and hydrating. I’ve also had more breakouts since using this which I usually never have.",,"https://images-na.ssl-images-amazon.com/images/S/amazon-avatars-global/a1c9fea8-ede2-496b-9df5-a9659de37e18._CR0,0,375,375_SX48_.jpg","Reviewed in the United States on August 4, 2024",One person found this helpful,Verified Purchase,,2,이 브랜드는 TikTok에서 큰 인기를 얻고 있으며 저는 인플루언서의 함정에 완전히 빠졌습니다. 나는 이것에 비해 훨씬 더 효과적이고 보습력이 좋은 DHC 클렌징 오일과 같은 더 나은 페이셜 오일을 사용했습니다. 나는 또한 평소에는 결코 경험하지 못했던 이것을 사용한 이후로 더 많은 탈주를 겪었습니다.
2.0 out of 5 stars,francelia,https://www.amazon.com/gp/customer-reviews/R1ZJPDC67GMMUC/ref=cm_cr_getr_d_rvw_ttl?ie=UTF8&ASIN=B0BN2PX8V3,"2.0 out of 5 stars
 It’s definitely not for sensitive skin!",When I used it I liked it at first but then I started noticing that I was Breaking me out more and my pimples were getting more red and inflamed. I would not buy this if you have sensitive skin.,,https://images-na.ssl-images-amazon.com/images/G/01/x-locale/common/grey-pixel.gif,"Reviewed in the United States on August 20, 2024",0,Verified Purchase,,2,그것을 사용했을 때 처음에는 마음에 들었지만 점점 더 많이 터지고 여드름이 더 붉어지고 염증이 생기기 시작했습니다. 피부가 예민하신 분들은 구매하지 않으실 것 같아요.
2.0 out of 5 stars,Moon,https://www.amazon.com/gp/customer-reviews/RBGTGBLNSMSGX/ref=cm_cr_getr_d_rvw_ttl?ie=UTF8&ASIN=B0BN2PX8V3,"2.0 out of 5 stars
 The scent is too strong!","I use this oil to double cleanse and while it does an ok job, the scent is enough for me to never want to purchase this again. The scent is very strong and almost smells like an essential oil of sorts. I would definitely not recommend this product if you’re sensitive to fragrance. Aside from that, it’s pretty gentle and does ok to remove my makeup if it’s not heavy (I always find residue if it is). I also found that this oil does well with oil gritting! So if strong scents are not an issue for you, go for it, but if they are, do not purchase this!!",,https://images-na.ssl-images-amazon.com/images/G/01/x-locale/common/grey-pixel.gif,"Reviewed in the United States on February 11, 2024",0,Verified Purchase,,2,"저는 이 오일을 사용하여 이중 클렌징을 하고, 효과는 괜찮지만, 다시는 구매하고 싶지 않을 만큼 향이 충분합니다. 향은 매우 강하고 거의 에센셜 오일 냄새와 비슷합니다. 향에 민감하신 분이라면 이 제품을 절대 추천드리지 않습니다. 그 외에도 꽤 순하고 무겁지 않으면 메이크업을 지워도 괜찮습니다. (저는 잔여물이 남는 경우가 많습니다.) 나는 또한 이 오일이 오일 그리팅에 잘 맞는다는 것을 발견했습니다! 그러니 강한 향기가 문제가 되지 않는다면"
2.0 out of 5 stars,Marcus Alfred,https://www.amazon.com/gp/customer-reviews/R1P7OMTO8VGZ1X/ref=cm_cr_getr_d_rvw_ttl?ie=UTF8&ASIN=B0BN2PX8V3,"2.0 out of 5 stars
 Horrible/painful reaction","Preface- I have been a licensed esthetician for 7 years and specialize in holistic wellness with normal/dry skin

This oil was great in the beginning as a first step to my double cleansing routine. After about 2 weeks my skin began to get scaly and thin blisters started to rise. Not pustules full on blisters.

I pride myself on the extent that I take care of my skin and was really disappointed when this reaction happened.

Also my sister who has combo oily skin had the same reaction to this cleanser and hers has been worse and is lasting longer.","https://m.media-amazon.com/images/I/61cxxch1DmL.88.jpg  
https://m.media-amazon.com/images/I/61hIr2BNYCL.88.jpg  
",https://images-na.ssl-images-amazon.com/images/G/01/x-locale/common/grey-pixel.gif,"Reviewed in the United States on February 15, 2024",10 people found this helpful,Verified Purchase,,2,"머리말- 저는 7년 동안 미용사 자격증을 갖고 있으며 중성/건성 피부의 전체적인 웰니스를 전문으로 합니다.

이 오일은 처음에는 이중 클렌징 루틴의 첫 번째 단계로 훌륭했습니다. 2주 정도 지나자 피부에 각질이 생기기 시작했고 얇은 물집이 생기기 시작했습니다. 물집에 농포가 가득하지 않습니다.

제가 피부관리를 잘하고 있다는 자부심이 있는데 이런 반응이 나와서 정말 실망했어요.

복합성 지성 피부를 갖고 있는 제 여동생도 이 클렌저에 대해 같은 반응을 보였습니다."
2.0 out of 5 stars,Valeria,https://www.amazon.com/gp/customer-reviews/R20LNTNBCC8GK3/ref=cm_cr_getr_d_rvw_ttl?ie=UTF8&ASIN=B0BN2PX8V3,"2.0 out of 5 stars
 Very good at first but it got worse and worse","One of the worst products I could have bought
At the beginning it was wonderful it left my skin quite clean and great.
But after 2 months of use, pimples started to appear where I had never been able to get it (chin), right now I have an acne outbreak and I'm almost sure it was because of this product, really if you have the opportunity to buy it DON'T DO IT!!!",,https://images-na.ssl-images-amazon.com/images/G/01/x-locale/common/grey-pixel.gif,"Reviewed in the United States on June 30, 2024",One person found this helpful,Verified Purchase,,2,"내가 살 수 있었던 최악의 제품 중 하나
처음에는 피부가 아주 깨끗하고 훌륭해져서 정말 좋았습니다.
하지만 사용 2개월 후, 한번도 생기지 않았던 부위(턱)에 여드름이 나타나기 시작했습니다. 지금 여드름이 발생하고 있으며 이 제품 때문인 것이 거의 확실합니다. 정말로 구매할 기회가 있다면 구매하지 마세요!!!"
2.0 out of 5 stars,Gabriela Garza,https://www.amazon.com/gp/customer-reviews/R156BB5G7RY7DB/ref=cm_cr_getr_d_rvw_ttl?ie=UTF8&ASIN=B0BN2PX8V3,"2.0 out of 5 stars
 Made my rosacea flare horribly",I started using it and suddenly my rosacea flared my face felt super hot and was super red all day. I couldn’t figure out what it was until I stopped using for two days and my face was back to normal. I used it again just to be for sure that’s what it was and it happened again. Unfortunately I threw away the box so it’s not like I can return it but I still wanted to warn anyone with sensitive skin who happen to have rosacea.,,https://images-na.ssl-images-amazon.com/images/G/01/x-locale/common/grey-pixel.gif,"Reviewed in the United States on March 14, 2024",One person found this helpful,Verified Purchase,,2,나는 그것을 사용하기 시작했고 갑자기 내 주사비가 타올랐고 내 얼굴은 매우 뜨겁고 하루 종일 매우 붉어졌습니다. 이틀 동안 사용을 중단하고 얼굴이 정상으로 돌아올 때까지는 그것이 무엇인지 알 수 없었습니다. 나는 그것이 무엇인지 확인하기 위해 그것을 다시 사용했고 그런 일이 다시 일어났습니다. 아쉽게도 박스를 버려서 반품은 어려울 것 같지만 혹시라도 주사비를 앓고 계시는 민감성 피부이신 분들에게 주의를 드리고 싶었습니다.
2.0 out of 5 stars,Sophia Harma,https://www.amazon.com/gp/customer-reviews/R2T1THSMEZEP65/ref=cm_cr_getr_d_rvw_ttl?ie=UTF8&ASIN=B0BN2PX8V3,"2.0 out of 5 stars
 Broke me out","I have sensitive skin so this worked for about two weeks before I started to notice breakouts on my cheeks, nose area, and forehead. I was using this maybe only twice a week so I was surprised that it was making my skin worse.",,https://images-na.ssl-images-amazon.com/images/G/01/x-locale/common/grey-pixel.gif,"Reviewed in the United States on August 4, 2024",0,Verified Purchase,,2,"나는 민감한 피부를 가지고 있기 때문에 약 2주 동안 효과가 있었고 뺨, 코 부분, 이마에 발진이 생기기 시작했습니다. 일주일에 두 번 정도만 사용했는데 피부가 더 나빠지는 것에 놀랐습니다."
2.0 out of 5 stars,Michael Posner,https://www.amazon.com/gp/customer-reviews/RSJA7F1BH4CYJ/ref=cm_cr_getr_d_rvw_ttl?ie=UTF8&ASIN=B0BN2PX8V3,"2.0 out of 5 stars
 not good for all skin types","i have acne prone, greasy skin and used this along with the water based face wash they have for a couple weeks and it made me break out a ton. just be wary of using it on certain skin types, probably better for dry skin",,"https://images-na.ssl-images-amazon.com/images/S/amazon-avatars-global/default._CR0,0,1024,1024_SX48_.png","Reviewed in the United States on August 2, 2024",0,Verified Purchase,,2,나는 여드름이 나기 쉽고 기름진 피부를 가지고 있으며 이것을 몇 주 동안 그들이 가지고 있는 수성 세안제와 함께 사용했는데 그것은 나를 엄청나게 돋보이게 만들었습니다. 특정 피부 타입에 사용하는 것을 주의하세요. 아마도 건성 피부에 더 좋을 것 같아요
2.0 out of 5 stars,Kev,https://www.amazon.com/gp/customer-reviews/RB0PXIX0VWJA5/ref=cm_cr_getr_d_rvw_ttl?ie=UTF8&ASIN=B0BN2PX8V3,"2.0 out of 5 stars
 It’s great, but not for my acne prone skin","The product was amazing at getting my makeup off, and releasing blackheads, however it seemed to trigger my acne and give me fungal acne. It may have been because I didn’t wash it off well enough but after a month of trying different ways, my skin was needing to give it up",,"https://images-na.ssl-images-amazon.com/images/S/amazon-avatars-global/default._CR0,0,1024,1024_SX48_.png","Reviewed in the United States on July 19, 2024",0,Verified Purchase,,2,이 제품은 메이크업을 지우고 블랙헤드를 제거하는 데는 놀라웠지만 여드름을 유발하고 곰팡이성 여드름을 일으키는 것 같았습니다. 잘 안씻겨서 그랬을지도 모르지만 한달동안 여러가지 방법을 시도하다보니 피부가 포기하게 되었어요
2.0 out of 5 stars,Vianey J.,https://www.amazon.com/gp/customer-reviews/R1DD07YFF75DQA/ref=cm_cr_getr_d_rvw_ttl?ie=UTF8&ASIN=B0BN2PX8V3,"2.0 out of 5 stars
 Made me breakout",This made me breakout :( I’ve been looking for the perfect oil cleanser but this isn’t the one if you have sensitive skin.,,"https://images-na.ssl-images-amazon.com/images/S/amazon-avatars-global/default._CR0,0,1024,1024_SX48_.png","Reviewed in the United States on October 10, 2024",One person found this helpful,Verified Purchase,,2,이로 인해 트러블이 생겼습니다 :( 저는 완벽한 오일 클렌저를 찾고 있었지만 민감한 피부를 가진 분에게는 이 제품이 아닙니다.
2.0 out of 5 stars,Hawkeye,https://www.amazon.com/gp/customer-reviews/R1QQ59847NWXRG/ref=cm_cr_getr_d_rvw_ttl?ie=UTF8&ASIN=B0BN2PX8V3,"2.0 out of 5 stars
 Not for me","This initially made my skin feel amazing but it made me break out. I have really oily skin that never breaks out now that I'm 30. This made me break out like I was in highschool again. I gifted it to my friend with combo skin and she loves it, though. Just be wary if you have super oily skin!",,"https://images-na.ssl-images-amazon.com/images/S/amazon-avatars-global/default._CR0,0,1024,1024_SX48_.png","Reviewed in the United States on July 3, 2024",0,Verified Purchase,,2,처음에는 피부가 정말 놀라웠지만 그것은 나를 무너지게 만들었습니다. 나는 이제 30세가 되어도 결코 터지지 않는 정말 지성 피부를 가지고 있습니다. 이것은 나를 다시 고등학생처럼 터지게 만들었습니다. 콤보 스킨이 있는 친구에게 선물했는데 친구가 너무 좋아하네요. 극도로 지성인 피부라면 주의하세요!
2.0 out of 5 stars,Jaione,https://www.amazon.com/gp/customer-reviews/R17OV0898TH9Z7/ref=cm_cr_getr_d_rvw_ttl?ie=UTF8&ASIN=B0BN2PX8V3,"2.0 out of 5 stars
 Not for me","It feels good messaging it on my face, but once I take it off after emulsifing the cleanser with water, and drying it with a bady towel, my face is super dry within 3-5 minutes. Not like a good moisturized dry, but you can see like ash on my face. I would also try it another way where after emulsifing the oil cleanser with water, I go in with a water based cleanser. It still comes out the same.
Don't think this is the oil cleaner for me. I have acne prone, oily, sensitive skin.",,"https://images-na.ssl-images-amazon.com/images/S/amazon-avatars-global/default._CR0,0,1024,1024_SX48_.png","Reviewed in the United States on December 23, 2023",One person found this helpful,Verified Purchase,,2,"얼굴에 바르는 느낌은 좋은데, 클렌저를 물로 유화시킨 뒤, 수건으로 닦아내고 떼어내면 3~5분 만에 얼굴이 엄청 건조해집니다. 촉촉하게 건조된 느낌은 아니지만, 얼굴에 잿더미가 보인답니다. 오일 클렌저를 물로 유화시킨 후 워터 베이스 클렌저를 사용하는 다른 방법도 시도해 보고 싶습니다. 아직도 똑같이 나오네요.
이것이 나를 위한 오일 클리너라고 생각하지 마십시오. 나는 여드름이 나기 쉽고 지성이며 민감한 피부를 가지고 있습니다."
2.0 out of 5 stars,Jessica Rackley,https://www.amazon.com/gp/customer-reviews/R26Q7C5N6WQVTK/ref=cm_cr_getr_d_rvw_ttl?ie=UTF8&ASIN=B0BN2PX8V3,"2.0 out of 5 stars
 Used it correctly, caused breakouts...","I really wanted this to work, the korean skintok girlies got me. But after over a month of *consistently cleansing according to the directions,* then following with the deep pore cleanser as suggested, I am having worse acne and in more places than with my good ol' drugstore cleanser. I have dry, acne prone skin, and rosacea, I feel like this also made my skin more red after using, whether I was gently rubbing or more ""scrubbing."" Would not recommend if you're acne prone!","https://m.media-amazon.com/images/I/61QwqHwSK6L.88.jpg  
https://m.media-amazon.com/images/I/71SjOqDETSL.88.jpg  
",https://images-na.ssl-images-amazon.com/images/G/01/x-locale/common/grey-pixel.gif,"Reviewed in the United States on May 5, 2024",2 people found this helpful,Verified Purchase,,2,"나는 이것이 효과가 있기를 정말로 원했고, 한국의 스킨톡 소녀들이 나를 사로잡았습니다. 그러나 한 달 이상 *지침에 따라 지속적으로 클렌징*한 후, 제안된 대로 딥 모공 클렌저를 사용한 후, 나는 내 좋은 약국 클렌저를 사용한 것보다 여드름이 더 심하고 더 많은 곳에서 발생했습니다. 나는 건조하고 여드름이 잘 나는 피부와 주사비를 가지고 있습니다. 부드럽게 문지르든 더 많이 ""스크러빙""하든 사용 후 피부가 더 붉어지는 것 같습니다. 여드름이 나기 쉬운 분이라면 추천하지 않습니다!"
2.0 out of 5 stars,AM,https://www.amazon.com/gp/customer-reviews/RJMS0EIXPZ30U/ref=cm_cr_getr_d_rvw_ttl?ie=UTF8&ASIN=B0BN2PX8V3,"2.0 out of 5 stars
 Nice but could be better","Removes makeup easily. Yet has a strong fragrance scent to it, which I don't like. When adding water it gets milky on the face then drips all over me and the sink when I wash my face. I'm not a fan.",,https://images-na.ssl-images-amazon.com/images/G/01/x-locale/common/grey-pixel.gif,"Reviewed in the United States on September 2, 2024",0,Verified Purchase,,2,"메이크업을 쉽게 지울 수 있습니다. 하지만 강한 향이 나는데, 나는 그것을 좋아하지 않습니다. 물을 넣으면 얼굴에 우유빛이 돌다가 세안할 때 온 몸에 흘러내리고 세면대에도 뚝뚝 떨어집니다. 나는 팬이 아니다."
2.0 out of 5 stars,Arianna Perez,https://www.amazon.com/gp/customer-reviews/R3SKQ4NK21BLW2/ref=cm_cr_getr_d_rvw_ttl?ie=UTF8&ASIN=B0BN2PX8V3,"2.0 out of 5 stars
 Disappointing",My friends love the product so I ordered immediately . My oil smells rancid and would not works as my fiend’s. I was trying to use so the return period expired and can no longer return. In the other hand I do love their scrub !that one is a must.,,https://images-na.ssl-images-amazon.com/images/G/01/x-locale/common/grey-pixel.gif,"Reviewed in the United States on July 16, 2024",0,Verified Purchase,,2,친구들이 제품을 너무 좋아해서 바로 주문했어요. 내 기름은 썩은 냄새가 나고 내 마귀의 기름처럼 작동하지 않습니다. 사용하려고 했더니 반품기간이 지나서 더 이상 반품이 안되네요. 반면에 나는 그들의 스크럽을 좋아합니다! 그것은 필수입니다.
2.0 out of 5 stars,Payton Cooley,https://www.amazon.com/gp/customer-reviews/R2JB9SPY49PKLD/ref=cm_cr_getr_d_rvw_ttl?ie=UTF8&ASIN=B0BN2PX8V3,"2.0 out of 5 stars
 Damaged",The box was almost completely destroyed and the tip was completely broken off.,"https://m.media-amazon.com/images/I/61IpxGtW5IL.88.jpg  
",https://images-na.ssl-images-amazon.com/images/G/01/x-locale/common/grey-pixel.gif,"Reviewed in the United States on November 21, 2024",0,Verified Purchase,,2,상자는 거의 완전히 부서졌고 끝 부분은 완전히 부러졌습니다.
